{
  "$schema": "./GovernancePrimitives.schema.json",
  "metadata": {
    "document_id": "governance_primitives.json",
    "title": "Governance Primitives",
    "context": "Global governance for the CLI harness. These primitives govern agent operation, execution boundaries, runtime artifact semantics, and authority separation when the harness is invoked against any target project repository, including the harness repository itself.",
    "purpose": "Define global harness-level invariants that every target project repository workflow must respect. Target-project intent, product scope, acceptance probes, implementation details, and repo-local decisions belong in that target repository's project_spec and operational state files.",
    "source_format": "json",
    "document_authority": "global_harness"
  },
  "governance_posture": {
    "invariant_constraints": [
      "The harness is a local CLI governance runtime that can be invoked against any target repository, including its own repository.",
      "Global governance defines execution boundaries for harness-mediated agent work, not target-project product intent.",
      "Each target repository supplies its own project_spec as the repo-local authority for project purpose, scope, acceptance probes, non-goals, and implementation criteria.",
      "Explicit separation must be preserved between project_spec authority, current task authority, role contracts, runtime_inputs, runtime_outputs schemas, returned runtime_outputs, and saved runtime artifacts.",
      "Agents cannot inspect files outside the provided runtime_inputs.",
      "Runtime_inputs are compiled by deterministic harness code before an agent call; the compiler is not an agent.",
      "Agents do not receive ambient repository access by default.",
      "The Project Manager role is always read-only and must not receive file mutation, shell execution, worker-adapter, or broad tool permissions.",
      "Non-PM roles may only receive tool permissions through explicit route and agent-contract definitions.",
      "Implementation authority is represented by documented state transitions, not by conversational momentum or implicit model preference.",
      "Structured JSON is the authoritative artifact format where the source is object-shaped.",
      "runtime_outputs refers to agent-specific turns that produce structured artifacts under an explicit return contract.",
      "No runtime capability claim is trustworthy without saved evidence appropriate to the claim.",
      "No silent compatibility shims, fallback formats, or legacy behavior preservation are assumed unless explicitly authorized."
    ],
    "role_surface": {
      "known_role_categories": [
        "project_manager",
        "planning_manager",
        "review_manager",
        "red_team_manager",
        "implementation_manager",
        "archive_manager",
        "worker_adapter"
      ],
      "role_contract_rule": "Role-specific behavior, prompts, return contracts, context policy, model/provider settings, and tool permissions live in agent contracts rather than in global governance prose.",
      "project_manager_rule": "Project Manager is a governance/recommendation role only. It may classify, summarize, identify tensions, and recommend admissible next transformations, but it cannot authorize, inspect ambient files, mutate files, run shell commands, or invoke workers.",
      "implementation_rule": "Implementation work may be delegated only after task authority has been created from repo-local operational state, such as a selected implementation-plan seam, and only through an explicit implementer or worker-adapter route.",
      "worker_adapter_rule": "Worker adapters are execution surfaces, not governance authorities. They may act only inside the task, route, tool, and target-repository constraints they are given."
    },
    "artifact_semantics": {
      "authoring_artifacts": [
        "Schemas.",
        "Templates.",
        "Examples.",
        "Fixtures.",
        "Sample runtime_outputs."
      ],
      "runtime_artifacts": [
        "Compiled runtime_inputs.",
        "Agent runtime_outputs.",
        "Saved run artifacts.",
        "Validation summaries.",
        "Probe results when the target project defines probes."
      ],
      "authoring_metadata_rule": "Examples and templates are authoring artifacts, not runtime artifacts. They may contain authoring metadata such as $schema when useful for IDE or human validation.",
      "runtime_metadata_rule": "Runtime-emitted model outputs must satisfy their runtime_outputs contract and must not be confused with examples, templates, or fixtures.",
      "fixture_rule": "Fixtures and samples must be labeled as fixtures or samples and must not be presented as live runtime evidence."
    },
    "explicit_distinctions": [
      "Global harness governance versus target repository project_spec.",
      "Harness execution boundary versus target-project product intent.",
      "Project invariants versus current task authority.",
      "Policy versus prompt.",
      "Role contract versus runtime_outputs schema.",
      "runtime_inputs versus raw repository files.",
      "Compiled context versus ambient file access.",
      "Agent runtime_outputs versus saved runtime artifacts.",
      "Recommendation versus authorization.",
      "Planning artifact versus task authority.",
      "Governance role versus execution/worker surface.",
      "Authoring artifact versus runtime artifact.",
      "Scaffold-only evidence versus runtime-evidenced behavior.",
      "Repo-local open decisions versus global harness governance.",
      "Model/provider configuration versus provider-specific behavior."
    ]
  },
  "approval_boundaries": {
    "explicit_approval_required_to_modify": {
      "global_governance": [
        "Harness-level authority semantics.",
        "Agent execution boundaries.",
        "Role category meanings.",
        "Authorization/state-transition rules.",
        "Artifact class semantics.",
        "Compatibility commitments.",
        "Global source-of-truth rules."
      ],
      "role_contract": [
        "Role identity.",
        "Role mode.",
        "Return contract path.",
        "Context policy.",
        "Default model/provider route.",
        "Allowed tool behavior.",
        "Whether a role may invoke a worker adapter."
      ],
      "runtime_outputs_contract": [
        "runtime_outputs schemas.",
        "Pydantic models used as runtime contracts.",
        "Required fields.",
        "Status enum semantics.",
        "Cross-field validation rules.",
        "Validation strictness.",
        "Artifact shape expected by downstream runtime code."
      ],
      "compiler_and_context_policy": [
        "Which target-repository sources may enter runtime_inputs.",
        "Required versus optional context sources.",
        "Missing-source behavior.",
        "Context-packet structure.",
        "Any policy that expands context collection beyond repo-local files already authorized by the target project."
      ],
      "runtime_orchestration": [
        "Route selection behavior.",
        "State-transition behavior.",
        "Run artifact writing behavior.",
        "Validation order.",
        "Error handling that changes whether work proceeds or stops.",
        "Any change that allows agents to select arbitrary next agents."
      ],
      "tool_and_worker_surface": [
        "Giving a role file mutation capability.",
        "Giving a role shell execution capability.",
        "Giving a role web or network capability.",
        "Giving a role worker-adapter invocation capability.",
        "Allowing implementer routes to spawn parallel worker agents.",
        "Changing boundaries around what a worker adapter may mutate."
      ],
      "provider_or_api_behavior": [
        "Switching the first runtime path away from the OpenAI Responses API.",
        "Adding provider abstraction.",
        "Hardcoding provider-specific model identity into global schemas.",
        "Changing structured-output behavior.",
        "Changing retry behavior.",
        "Changing streaming behavior.",
        "Changing API-cost-affecting call graphs."
      ],
      "compatibility_and_fallback_commitment": [
        "Preserving old prompt paths.",
        "Maintaining duplicate policy formats.",
        "Adding migration shims.",
        "Promising legacy artifact compatibility.",
        "Supporting multiple scaffold layouts.",
        "Treating fallback behavior as normal runtime behavior."
      ]
    },
    "repo_local_boundaries": "Target-project product scope, non-goals, acceptance probes, implementation criteria, project-specific open decisions, and project-specific known failures belong in the target repository's project_spec and operational state files, not in global governance primitives."
  },
  "invariants_and_integrity_constraints": {
    "authority_scope": {
      "global_harness_authority": [
        "Agent operation boundaries.",
        "Role and route separation.",
        "runtime_inputs and runtime_outputs contract discipline.",
        "Tool and worker-adapter boundary discipline.",
        "Artifact semantics.",
        "Validation and evidence discipline.",
        "Compatibility and fallback discipline."
      ],
      "repo_local_authority": [
        "Target-project thesis and non-goals.",
        "Target-project acceptance probes.",
        "Target-project implementation plans and trackers.",
        "Target-project open decisions.",
        "Target-project known failures.",
        "Target-project archive and history."
      ],
      "conflict_handling": "If a target-repository request or artifact conflicts with global harness execution boundaries, the harness must stop or surface the conflict rather than silently weakening the global boundary.",